### ISSUE TITLE
Companion installed on Windows 11 Pro, WOL module fails to send WOL packets?

### ISSUE THREAD

**Issue by Jibun-no-Kage** [bitfocus/companion-module-generic-wakeonlan#10]
This is appears to be broken now as of this date, 08/26/2024 with companion 3.3 (current)  installed on Windows 11 Pro (current).  I can WOL a system, which supports WOL power on, from Linux, from my phone, from Windows 11 Pro, via small app for Windows.  But when I try to use the module with companion... nothing.  Which seems odd given the dedicated application on Windows 11 Pro works.  So must be internal module issue or library issue.

Using port 9, 500ms between attempts and retires set 10.  Thinking might be a timing issue.  But, no joy.  Anyone else having this issue?

**Comment by Jibun-no-Kage** [comment]
A bit of testing and capture via TCPdump... When I send WOL via the WOL module... it should send a packet 10 times, AT BEST, I get 1 packet, most of the time NO packets.  Below I pressed the button 10 times... so should have seen 100 packets received... I got 2... yes 2.  I am not an expert with TCPdump, but I think I using it right, reading the results right.
```
# tcpdump -i [redacted] port 9
tcpdump: verbose output suppressed, use -v[v]... for full protocol decode
listening on [redacted], link-type EN10MB (Ethernet), snapshot length 262144 bytes
20:17:41.570667 IP wacko.51390 > 255.255.255.255.discard: UDP, length 102
20:18:22.665748 IP wacko.51391 > 255.255.255.255.discard: UDP, length 102
```
Even though the target Linux system is dropping the packets, since port 9 is not open, I should see the Linux system drop/discard more than 2 packets, with 10 pushes of the test button in companion.  So the retries are not being done?  I changed the port to 22... and got the flood of packets one would expect when the Linux system has an active SSH session.

Testing using the WOL app in Windows to the same target, I send a single WOL command from the Windows app, and clearly it is trying multiple times... It is using a wide open versus local network broadcast, but 255.255.255.255 per my understanding should always work... and in fact it does with my TVs that use WOL to power on.
```
# tcpdump -i [redacted] port 9
tcpdump: verbose output suppressed, use -v[v]... for full protocol decode
listening on [redacted], link-type EN10MB (Ethernet), snapshot length 262144 bytes
20:29:44.532888 IP wacko.61283 > 192.168.1.255.discard: UDP, length 102
20:29:44.535043 IP wacko.61283 > 255.255.255.255.discard: UDP, length 102
20:29:44.541496 IP wacko.61283 > 192.168.1.255.discard: UDP, length 102
20:29:44.544610 IP wacko.61283 > 255.255.255.255.discard: UDP, length 102
20:29:44.550483 IP wacko.61283 > 192.168.1.255.discard: UDP, length 102
20:29:44.552745 IP wacko.61283 > 255.255.255.255.discard: UDP, length 102
20:29:44.558662 IP wacko.61283 > 192.168.1.255.discard: UDP, length 102
20:29:44.564701 IP wacko.61283 > 255.255.255.255.discard: UDP, length 102
20:29:44.570708 IP wacko.61283 > 192.168.1.255.discard: UDP, length 102
20:29:44.573105 IP wacko.61283 > 255.255.255.255.discard: UDP, length 102
```
I will also test tomorrow when I have access to companion on MacOS, just to compare with the above, which seems to work fine.  I only seem to see this odd behavior with the Windows 11 Pro installation of companion as noted above.

**Comment by Jibun-no-Kage** [comment]
One more interesting result...  Given the Windows 11 app alternated between 255.255.255.255 and 192.168.1.255, I tried the test button once sending 192.168.1.255 versus 255.255.255.255 as I did above, 10 packets sent.
```
# tcpdump -i [redacted] port 9
tcpdump: verbose output suppressed, use -v[v]... for full protocol decode
listening on [redacted], link-type EN10MB (Ethernet), snapshot length 262144 bytes
20:45:42.177967 IP wacko.64978 > 192.168.1.255.discard: UDP, length 102
20:45:42.678153 IP wacko.64978 > 192.168.1.255.discard: UDP, length 102
20:45:43.180801 IP wacko.64978 > 192.168.1.255.discard: UDP, length 102
20:45:43.687155 IP wacko.64978 > 192.168.1.255.discard: UDP, length 102
20:45:44.190941 IP wacko.64978 > 192.168.1.255.discard: UDP, length 102
20:45:44.692459 IP wacko.64978 > 192.168.1.255.discard: UDP, length 102
20:45:45.196676 IP wacko.64978 > 192.168.1.255.discard: UDP, length 102
20:45:45.699811 IP wacko.64978 > 192.168.1.255.discard: UDP, length 102
20:45:46.204404 IP wacko.64978 > 192.168.1.255.discard: UDP, length 102
20:45:46.711199 IP wacko.64978 > 192.168.1.255.discard: UDP, length 102
```
This makes absolutely no sense to me, which why 255.255.255.255 versus 192.168.1.255 has ANY difference.  We are talking about UDP here... send and forget, so the module code should just fire the packet and call it done.
